Title,Date,Article
Tata Motors (TTM) Q2 2020 Earnings Call Transcript,10 months ago,"Before we get started, I would like to remind everyone that today's call contains forward-looking statements within the meaning of the Private Securities Litigation Reform Act of 1995, including statements related to TTM's future business outlook.  This transaction provides us the balance sheet flexibility to continue the journey to increase TTMs focus on differentiation and less capital-intensive, less seasonal, long-cycle end markets."
Jaguar Land Rover names ousted Renault boss as CEO,10 months ago,"Jaguar Land Rover (JLR) <TAMO.NS> has picked ousted Renault boss Thierry Bollore as its next chief executive, with a mission to return Britain's biggest carmaker to profit after a big hit from the COVID-19 pandemic.  Bollore took over at Renault <RENA.PA> in January 2019 after the fall of Carlos Ghosn, but was always viewed a close to the French carmaker's long-time boss and was pushed out in October when it looked for a fresh start.  Bollore will take over at JLR on Sept. 10, replacing Ralf Speth, whose tenure ends after more than 10 years."
"DHL to cut 2,200 UK workers at Jaguar Land Rover factories, union says",11 months ago,"The job cuts comprise just under 40% of the entire DHL workforce on the contract, the union said.  DHL indicated that the half of the job cuts are due to a decline in car production and half are the result of anticipated ""efficeincy savings"", the union added.  ""DHL must not attempt to make permanent full-time staff redundant while continuing to outsource work to sub-contractors,"" Matt Draper, Unite national officer for logistics, said."
Tata Motors Group (TTM) Q4 2020 Earnings Call Transcript,11 months ago,"TTM earnings call for the period ending March 31, 2020."
"Tata Motors to shed 1,100 JLR jobs after pandemic hits earnings",11 months ago,"India's Tata Motors Ltd expects to shed about 1,100 temporary jobs at Jaguar Land Rover after it raised the cost-cutting target at its luxury unit by 1 billion pounds ($1.26 billion) to ride out the disruptions caused by the coronavirus outbreak.  Tata Motors expects to save 5 billion pounds in costs by March 2021 at its Jaguar Land Rover (JLR) unit, the Indian automaker's Chief Financial Officer PB Balaji said on Monday, adding 3.5 billion pounds of the savings had already been achieved.  It will also reduce capital expenditure at JLR to 2.5 billion pounds for the current fiscal year, from the more than 3 billion pounds it has spent annually in previous years."
JLR raises $705 million loan from Chinese banks,last year,"Jaguar Land Rover (JLR), owned by India's Tata Motors <TAMO.NS>, has entered into agreements with lenders in China for an unsecured 3-year term loan facility of 5 billion yuan ($704.50 million), marking its first debt financing in China, it said.  Arthur Yu, JLR's vice president and China chief financial officer, said the Chinese banks that would provide it with the three-year revolving loan include Bank of China <601988.SS>, ICBC <601398.SS>, China Construction Bank <601939.SS>, Bank of Communications <601328.SS> and Shanghai Pudong Development Bank <600000.SS>."
Jaguar Land Rover raises $705 million loan from Chinese banks,last year,"Jaguar Land Rover (JLR), owned by India's Tata Motors <TAMO.NS>, has entered into agreements with lenders in China for an unsecured 3-year term loan facility of 5 billion yuan (556.58 million pounds), marking its first debt financing in China, it said.  Arthur Yu, JLR's vice president and China chief financial officer, said the Chinese banks that would provide it with the three-year revolving loan include Bank of China <601988.SS>, ICBC <601398.SS>, China Construction Bank <601939.SS>, Bank of Communications <601328.SS> and Shanghai Pudong Development Bank <600000.SS>."